code_type,code_value,description,hcc_id
ICD10CM,G70.81,Lambert-Eaton syndrome in disease classified elsewhere,75
ICD10CM,G70.89,Other specified myoneural disorders,75
ICD10CM,G70.9,"Myoneural disorder, unspecified",75
ICD10CM,G73.1,Lambert-Eaton syndrome in neoplastic disease,75
ICD10CM,G73.3,Myasthenic syndromes in other diseases classified elsewhere,75
ICD10CM,M05.50,Rheumatoid polyneuropathy with rheumatoid arthritis of unspecified site,75
ICD10CM,M05.511,Rheumatoid polyneuropathy with rheumatoid arthritis of right shoulder,75
ICD10CM,M05.512,Rheumatoid polyneuropathy with rheumatoid arthritis of left shoulder,75
ICD10CM,M05.519,Rheumatoid polyneuropathy with rheumatoid arthritis of unspecified shoulder,75
ICD10CM,M05.521,Rheumatoid polyneuropathy with rheumatoid arthritis of right elbow,75
ICD10CM,M05.522,Rheumatoid polyneuropathy with rheumatoid arthritis of left elbow,75
ICD10CM,M05.529,Rheumatoid polyneuropathy with rheumatoid arthritis of unspecified elbow,75
ICD10CM,M05.531,Rheumatoid polyneuropathy with rheumatoid arthritis of right wrist,75
ICD10CM,M05.532,Rheumatoid polyneuropathy with rheumatoid arthritis of left wrist,75
ICD10CM,M05.539,Rheumatoid polyneuropathy with rheumatoid arthritis of unspecified wrist,75
ICD10CM,M05.541,Rheumatoid polyneuropathy with rheumatoid arthritis of right hand,75
ICD10CM,M05.542,Rheumatoid polyneuropathy with rheumatoid arthritis of left hand,75
ICD10CM,M05.549,Rheumatoid polyneuropathy with rheumatoid arthritis of unspecified hand,75
ICD10CM,M05.551,Rheumatoid polyneuropathy with rheumatoid arthritis of right hip,75
ICD10CM,M05.552,Rheumatoid polyneuropathy with rheumatoid arthritis of left hip,75
ICD10CM,M05.559,Rheumatoid polyneuropathy with rheumatoid arthritis of unspecified hip,75
ICD10CM,M05.561,Rheumatoid polyneuropathy with rheumatoid arthritis of right knee,75
ICD10CM,M05.562,Rheumatoid polyneuropathy with rheumatoid arthritis of left knee,75
ICD10CM,M05.569,Rheumatoid polyneuropathy with rheumatoid arthritis of unspecified knee,75
ICD10CM,M05.571,Rheumatoid polyneuropathy with rheumatoid arthritis of right ankle and foot,75
ICD10CM,M05.572,Rheumatoid polyneuropathy with rheumatoid arthritis of left ankle and foot,75
ICD10CM,M05.579,Rheumatoid polyneuropathy with rheumatoid arthritis of unspecified ankle and foot,75
ICD10CM,M05.59,Rheumatoid polyneuropathy with rheumatoid arthritis of multiple sites,75
ICD10CM,M34.83,Systemic sclerosis with polyneuropathy,75
ICD10CM,G71.0,Muscular dystrophy,76
ICD10CM,G71.11,Myotonic muscular dystrophy,76
ICD10CM,G71.2,Congenital myopathies,76
ICD10CM,G35,Multiple sclerosis,77
ICD10CM,G36.0,Neuromyelitis optica [Devic],77
ICD10CM,G36.1,Acute and subacute hemorrhagic leukoencephalitis [Hurst],77
ICD10CM,G36.8,Other specified acute disseminated demyelination,77
ICD10CM,G36.9,"Acute disseminated demyelination, unspecified",77
ICD10CM,G37.0,Diffuse sclerosis of central nervous system,77
ICD10CM,G37.1,Central demyelination of corpus callosum,77
ICD10CM,G37.2,Central pontine myelinolysis,77
ICD10CM,G37.5,Concentric sclerosis [Balo] of central nervous system,77
ICD10CM,G37.8,Other specified demyelinating diseases of central nervous system,77
ICD10CM,G37.9,"Demyelinating disease of central nervous system, unspecified",77
ICD10CM,G10,Huntington's disease,78
ICD10CM,G20,Parkinson's disease,78
ICD10CM,G21.11,Neuroleptic induced parkinsonism,78
ICD10CM,G21.19,Other drug induced secondary parkinsonism,78
ICD10CM,G21.2,Secondary parkinsonism due to other external agents,78
ICD10CM,G21.3,Postencephalitic parkinsonism,78
ICD10CM,G21.4,Vascular parkinsonism,78
ICD10CM,G21.8,Other secondary parkinsonism,78
ICD10CM,G21.9,"Secondary parkinsonism, unspecified",78
ICD10CM,G23.0,Hallervorden-Spatz disease,78
ICD10CM,G23.1,Progressive supranuclear ophthalmoplegia [Steele-Richardson-Olszewski],78
ICD10CM,G23.2,Striatonigral degeneration,78
ICD10CM,G23.8,Other specified degenerative diseases of basal ganglia,78
ICD10CM,G23.9,"Degenerative disease of basal ganglia, unspecified",78
ICD10CM,G90.3,Multi-system degeneration of the autonomic nervous system,78
ICD10CM,G40.001,"Localization-related (focal) (partial) idiopathic epilepsy and epileptic syndromes with seizures of localized onset, not intractable, with status epilepticus",79
ICD10CM,G40.009,"Localization-related (focal) (partial) idiopathic epilepsy and epileptic syndromes with seizures of localized onset, not intractable, without status epilepticus",79
ICD10CM,G40.011,"Localization-related (focal) (partial) idiopathic epilepsy and epileptic syndromes with seizures of localized onset, intractable, with status epilepticus",79
ICD10CM,G40.019,"Localization-related (focal) (partial) idiopathic epilepsy and epileptic syndromes with seizures of localized onset, intractable, without status epilepticus",79
ICD10CM,G40.101,"Localization-related (focal) (partial) symptomatic epilepsy and epileptic syndromes with simple partial seizures, not intractable, with status epilepticus",79
ICD10CM,G40.109,"Localization-related (focal) (partial) symptomatic epilepsy and epileptic syndromes with simple partial seizures, not intractable, without status epilepticus",79
ICD10CM,G40.111,"Localization-related (focal) (partial) symptomatic epilepsy and epileptic syndromes with simple partial seizures, intractable, with status epilepticus",79
ICD10CM,G40.119,"Localization-related (focal) (partial) symptomatic epilepsy and epileptic syndromes with simple partial seizures, intractable, without status epilepticus",79
ICD10CM,G40.201,"Localization-related (focal) (partial) symptomatic epilepsy and epileptic syndromes with complex partial seizures, not intractable, with status epilepticus",79
ICD10CM,G40.209,"Localization-related (focal) (partial) symptomatic epilepsy and epileptic syndromes with complex partial seizures, not intractable, without status epilepticus",79
ICD10CM,G40.211,"Localization-related (focal) (partial) symptomatic epilepsy and epileptic syndromes with complex partial seizures, intractable, with status epilepticus",79
ICD10CM,G40.219,"Localization-related (focal) (partial) symptomatic epilepsy and epileptic syndromes with complex partial seizures, intractable, without status epilepticus",79
ICD10CM,G40.301,"Generalized idiopathic epilepsy and epileptic syndromes, not intractable, with status epilepticus",79
ICD10CM,G40.309,"Generalized idiopathic epilepsy and epileptic syndromes, not intractable, without status epilepticus",79
ICD10CM,G40.311,"Generalized idiopathic epilepsy and epileptic syndromes, intractable, with status epilepticus",79
ICD10CM,G40.319,"Generalized idiopathic epilepsy and epileptic syndromes, intractable, without status epilepticus",79
ICD10CM,G40.401,"Other generalized epilepsy and epileptic syndromes, not intractable, with status epilepticus",79
ICD10CM,G40.409,"Other generalized epilepsy and epileptic syndromes, not intractable, without status epilepticus",79
ICD10CM,G40.411,"Other generalized epilepsy and epileptic syndromes, intractable, with status epilepticus",79
ICD10CM,G40.419,"Other generalized epilepsy and epileptic syndromes, intractable, without status epilepticus",79
ICD10CM,G40.501,"Epileptic seizures related to external causes, not intractable, with status epilepticus",79
ICD10CM,G40.509,"Epileptic seizures related to external causes, not intractable, without status epilepticus",79
ICD10CM,G40.801,"Other epilepsy, not intractable, with status epilepticus",79
ICD10CM,G40.802,"Other epilepsy, not intractable, without status epilepticus",79
ICD10CM,G40.803,"Other epilepsy, intractable, with status epilepticus",79
ICD10CM,G40.804,"Other epilepsy, intractable, without status epilepticus",79
ICD10CM,G40.811,"Lennox-Gastaut syndrome, not intractable, with status epilepticus",79
ICD10CM,G40.812,"Lennox-Gastaut syndrome, not intractable, without status epilepticus",79
ICD10CM,G40.813,"Lennox-Gastaut syndrome, intractable, with status epilepticus",79
ICD10CM,G40.814,"Lennox-Gastaut syndrome, intractable, without status epilepticus",79
ICD10CM,G40.821,"Epileptic spasms, not intractable, with status epilepticus",79
ICD10CM,G40.822,"Epileptic spasms, not intractable, without status epilepticus",79
ICD10CM,G40.823,"Epileptic spasms, intractable, with status epilepticus",79
ICD10CM,G40.824,"Epileptic spasms, intractable, without status epilepticus",79
ICD10CM,G40.89,Other seizures,79
ICD10CM,G40.901,"Epilepsy, unspecified, not intractable, with status epilepticus",79
ICD10CM,G40.909,"Epilepsy, unspecified, not intractable, without status epilepticus",79
ICD10CM,G40.911,"Epilepsy, unspecified, intractable, with status epilepticus",79
ICD10CM,G40.919,"Epilepsy, unspecified, intractable, without status epilepticus",79
ICD10CM,G40.A01,"Absence epileptic syndrome, not intractable, with status epilepticus",79
ICD10CM,G40.A09,"Absence epileptic syndrome, not intractable, without status epilepticus",79
ICD10CM,G40.A11,"Absence epileptic syndrome, intractable, with status epilepticus",79
ICD10CM,G40.A19,"Absence epileptic syndrome, intractable, without status epilepticus",79
ICD10CM,G40.B01,"Juvenile myoclonic epilepsy, not intractable, with status epilepticus",79
ICD10CM,G40.B09,"Juvenile myoclonic epilepsy, not intractable, without status epilepticus",79
ICD10CM,G40.B11,"Juvenile myoclonic epilepsy, intractable, with status epilepticus",79
ICD10CM,G40.B19,"Juvenile myoclonic epilepsy, intractable, without status epilepticus",79
ICD10CM,R56.00,Simple febrile convulsions,79
ICD10CM,R56.01,Complex febrile convulsions,79
ICD10CM,R56.1,Post traumatic seizures,79
ICD10CM,R56.9,Unspecified convulsions,79
ICD10CM,G93.1,"Anoxic brain damage, not elsewhere classified",80
ICD10CM,G93.5,Compression of brain,80
ICD10CM,G93.6,Cerebral edema,80
ICD10CM,R40.20,Unspecified coma,80
ICD10CM,R40.2110,"Coma scale, eyes open, never, unspecified time",80
ICD10CM,R40.2111,"Coma scale, eyes open, never, in the field [EMT or ambulance]",80
ICD10CM,R40.2112,"Coma scale, eyes open, never, at arrival to emergency department",80
ICD10CM,R40.2113,"Coma scale, eyes open, never, at hospital admission",80
ICD10CM,R40.2114,"Coma scale, eyes open, never, 24 hours or more after hospital admission",80
ICD10CM,R40.2120,"Coma scale, eyes open, to pain, unspecified time",80
ICD10CM,R40.2121,"Coma scale, eyes open, to pain, in the field [EMT or ambulance]",80
ICD10CM,R40.2122,"Coma scale, eyes open, to pain, at arrival to emergency department",80
ICD10CM,R40.2123,"Coma scale, eyes open, to pain, at hospital admission",80
ICD10CM,R40.2124,"Coma scale, eyes open, to pain, 24 hours or more after hospital admission",80
ICD10CM,R40.2210,"Coma scale, best verbal response, none, unspecified time",80
ICD10CM,R40.2211,"Coma scale, best verbal response, none, in the field [EMT or ambulance]",80
ICD10CM,R40.2212,"Coma scale, best verbal response, none, at arrival to emergency department",80
ICD10CM,R40.2213,"Coma scale, best verbal response, none, at hospital admission",80
ICD10CM,R40.2214,"Coma scale, best verbal response, none, 24 hours or more after hospital admission",80
ICD10CM,R40.2220,"Coma scale, best verbal response, incomprehensible words, unspecified time",80
ICD10CM,R40.2221,"Coma scale, best verbal response, incomprehensible words, in the field [EMT or ambulance]",80
ICD10CM,R40.2222,"Coma scale, best verbal response, incomprehensible words, at arrival to emergency department",80
ICD10CM,R40.2223,"Coma scale, best verbal response, incomprehensible words, at hospital admission",80
ICD10CM,R40.2224,"Coma scale, best verbal response, incomprehensible words, 24 hours or more after hospital admission",80
ICD10CM,R40.2310,"Coma scale, best motor response, none, unspecified time",80
ICD10CM,R40.2311,"Coma scale, best motor response, none, in the field [EMT or ambulance]",80
ICD10CM,R40.2312,"Coma scale, best motor response, none, at arrival to emergency department",80
ICD10CM,R40.2313,"Coma scale, best motor response, none, at hospital admission",80
ICD10CM,R40.2314,"Coma scale, best motor response, none, 24 hours or more after hospital admission",80
ICD10CM,R40.2320,"Coma scale, best motor response, extension, unspecified time",80
ICD10CM,R40.2321,"Coma scale, best motor response, extension, in the field [EMT or ambulance]",80
ICD10CM,R40.2322,"Coma scale, best motor response, extension, at arrival to emergency department",80
ICD10CM,R40.2323,"Coma scale, best motor response, extension, at hospital admission",80
ICD10CM,R40.2324,"Coma scale, best motor response, extension, 24 hours or more after hospital admission",80
ICD10CM,R40.2340,"Coma scale, best motor response, flexion withdrawal, unspecified time",80
ICD10CM,R40.2341,"Coma scale, best motor response, flexion withdrawal, in the field [EMT or ambulance]",80
ICD10CM,R40.2342,"Coma scale, best motor response, flexion withdrawal, at arrival to emergency department",80
ICD10CM,R40.2343,"Coma scale, best motor response, flexion withdrawal, at hospital admission",80
ICD10CM,R40.2344,"Coma scale, best motor response, flexion withdrawal, 24 hours or more after hospital admission",80
ICD10CM,R40.2430,"Glasgow coma scale score 3-8, unspecified time",80
ICD10CM,R40.2431,"Glasgow coma scale score 3-8, in the field [EMT or ambulance]",80
ICD10CM,R40.2432,"Glasgow coma scale score 3-8, at arrival to emergency department",80
ICD10CM,R40.2433,"Glasgow coma scale score 3-8, at hospital admission",80
ICD10CM,R40.2434,"Glasgow coma scale score 3-8, 24 hours or more after hospital admission",80
ICD10CM,R40.2440,"Other coma, without documented Glasgow coma scale score, or with partial score reported, unspecified time",80
ICD10CM,R40.2441,"Other coma, without documented Glasgow coma scale score, or with partial score reported, in the field [EMT or ambulance]",80
ICD10CM,R40.2442,"Other coma, without documented Glasgow coma scale score, or with partial score reported, at arrival to emergency department",80
ICD10CM,R40.2443,"Other coma, without documented Glasgow coma scale score, or with partial score reported, at hospital admission",80
ICD10CM,R40.2444,"Other coma, without documented Glasgow coma scale score, or with partial score reported, 24 hours or more after hospital admission",80
ICD10CM,R40.3,Persistent vegetative state,80
ICD10CM,J95.00,Unspecified tracheostomy complication,82
ICD10CM,J95.01,Hemorrhage from tracheostomy stoma,82
ICD10CM,J95.02,Infection of tracheostomy stoma,82
ICD10CM,J95.03,Malfunction of tracheostomy stoma,82
ICD10CM,J95.04,Tracheo-esophageal fistula following tracheostomy,82
ICD10CM,J95.09,Other tracheostomy complication,82
ICD10CM,J95.850,Mechanical complication of respirator,82
ICD10CM,J95.859,Other complication of respirator [ventilator],82
ICD10CM,Z43.0,Encounter for attention to tracheostomy,82
ICD10CM,Z93.0,Tracheostomy status,82
ICD10CM,Z99.11,Dependence on respirator [ventilator] status,82
ICD10CM,Z99.12,Encounter for respirator [ventilator] dependence during power failure,82
ICD10CM,R09.2,Respiratory arrest,83
ICD10CM,I46.2,Cardiac arrest due to underlying cardiac condition,84
ICD10CM,I46.8,Cardiac arrest due to other underlying condition,84
ICD10CM,I46.9,"Cardiac arrest, cause unspecified",84
ICD10CM,I49.01,Ventricular fibrillation,84
ICD10CM,I49.02,Ventricular flutter,84
ICD10CM,J80,Acute respiratory distress syndrome,84
ICD10CM,J81.0,Acute pulmonary edema,84
ICD10CM,J95.1,Acute pulmonary insufficiency following thoracic surgery,84
ICD10CM,J95.2,Acute pulmonary insufficiency following nonthoracic surgery,84
ICD10CM,J95.3,Chronic pulmonary insufficiency following surgery,84
ICD10CM,J95.821,Acute postprocedural respiratory failure,84
ICD10CM,J95.822,Acute and chronic postprocedural respiratory failure,84
ICD10CM,J96.00,"Acute respiratory failure, unspecified whether with hypoxia or hypercapnia",84
ICD10CM,J96.01,Acute respiratory failure with hypoxia,84
ICD10CM,J96.02,Acute respiratory failure with hypercapnia,84
ICD10CM,J96.10,"Chronic respiratory failure, unspecified whether with hypoxia or hypercapnia",84
ICD10CM,J96.11,Chronic respiratory failure with hypoxia,84
ICD10CM,J96.12,Chronic respiratory failure with hypercapnia,84
ICD10CM,J96.20,"Acute and chronic respiratory failure, unspecified whether with hypoxia or hypercapnia",84
ICD10CM,J96.21,Acute and chronic respiratory failure with hypoxia,84
ICD10CM,J96.22,Acute and chronic respiratory failure with hypercapnia,84
ICD10CM,J96.90,"Respiratory failure, unspecified, unspecified whether with hypoxia or hypercapnia",84
ICD10CM,J96.91,"Respiratory failure, unspecified with hypoxia",84
ICD10CM,J96.92,"Respiratory failure, unspecified with hypercapnia",84
ICD10CM,R57.0,Cardiogenic shock,84
ICD10CM,R57.9,"Shock, unspecified",84
ICD10CM,T81.11XA,"Postprocedural  cardiogenic shock, initial encounter",84
ICD10CM,A36.81,Diphtheritic cardiomyopathy,85
ICD10CM,B33.24,Viral cardiomyopathy,85
ICD10CM,I09.81,Rheumatic heart failure,85
ICD10CM,I11.0,Hypertensive heart disease with heart failure,85
ICD10CM,I13.0,"Hypertensive heart and chronic kidney disease with heart failure and stage 1 through stage 4 chronic kidney disease, or unspecified chronic kidney disease",85
ICD10CM,I13.2,"Hypertensive heart and chronic kidney disease with heart failure and with stage 5 chronic kidney disease, or end stage renal disease",85
ICD10CM,I26.01,Septic pulmonary embolism with acute cor pulmonale,85
ICD10CM,I26.02,Saddle embolus of pulmonary artery with acute cor pulmonale,85
ICD10CM,I26.09,Other pulmonary embolism with acute cor pulmonale,85
ICD10CM,I27.0,Primary pulmonary hypertension,85
ICD10CM,I27.1,Kyphoscoliotic heart disease,85
ICD10CM,I27.2,Other secondary pulmonary hypertension,85
ICD10CM,I27.20,"Pulmonary hypertension, unspecified",85
ICD10CM,I27.21,Secondary pulmonary arterial hypertension,85
ICD10CM,I27.22,Pulmonary hypertension due to left heart disease,85
ICD10CM,I27.23,Pulmonary hypertension due to lung diseases and hypoxia,85
ICD10CM,I27.24,Chronic thromboembolic pulmonary hypertension,85
ICD10CM,I27.29,Other secondary pulmonary hypertension,85
ICD10CM,I27.81,Cor pulmonale (chronic),85
ICD10CM,I27.83,Eisenmenger's syndrome,85
ICD10CM,I27.89,Other specified pulmonary heart diseases,85
ICD10CM,I27.9,"Pulmonary heart disease, unspecified",85
ICD10CM,I28.0,Arteriovenous fistula of pulmonary vessels,85
ICD10CM,I28.1,Aneurysm of pulmonary artery,85
ICD10CM,I28.8,Other diseases of pulmonary vessels,85
ICD10CM,I28.9,"Disease of pulmonary vessels, unspecified",85
ICD10CM,I42.0,Dilated cardiomyopathy,85
ICD10CM,I42.1,Obstructive hypertrophic cardiomyopathy,85
ICD10CM,I42.2,Other hypertrophic cardiomyopathy,85
ICD10CM,I42.3,Endomyocardial (eosinophilic) disease,85
ICD10CM,I42.4,Endocardial fibroelastosis,85
ICD10CM,I42.5,Other restrictive cardiomyopathy,85
ICD10CM,I42.6,Alcoholic cardiomyopathy,85
ICD10CM,I42.7,Cardiomyopathy due to drug and external agent,85
ICD10CM,I42.8,Other cardiomyopathies,85
ICD10CM,I42.9,"Cardiomyopathy, unspecified",85
ICD10CM,I43,Cardiomyopathy in diseases classified elsewhere,85
ICD10CM,I50.1,"Left ventricular failure, unspecified",85
ICD10CM,I50.20,Unspecified systolic (congestive) heart failure,85
ICD10CM,I50.21,Acute systolic (congestive) heart failure,85
ICD10CM,I50.22,Chronic systolic (congestive) heart failure,85
ICD10CM,I50.23,Acute on chronic systolic (congestive) heart failure,85
ICD10CM,I50.30,Unspecified diastolic (congestive) heart failure,85
ICD10CM,I50.31,Acute diastolic (congestive) heart failure,85
ICD10CM,I50.32,Chronic diastolic (congestive) heart failure,85
ICD10CM,I50.33,Acute on chronic diastolic (congestive) heart failure,85
ICD10CM,I50.40,Unspecified combined systolic (congestive) and diastolic (congestive) heart failure,85
ICD10CM,I50.41,Acute combined systolic (congestive) and diastolic (congestive) heart failure,85
ICD10CM,I50.42,Chronic combined systolic (congestive) and diastolic (congestive) heart failure,85
ICD10CM,I50.43,Acute on chronic combined systolic (congestive) and diastolic (congestive) heart failure,85
ICD10CM,I50.810,"Right heart failure, unspecified",85
ICD10CM,I50.811,Acute right heart failure,85
ICD10CM,I50.812,Chronic right heart failure,85
ICD10CM,I50.813,Acute on chronic right heart failure,85
ICD10CM,I50.814,Right heart failure due to left heart failure,85
ICD10CM,I50.82,Biventricular heart failure,85
ICD10CM,I50.83,High output heart failure,85
ICD10CM,I50.84,End stage heart failure,85
ICD10CM,I50.89,Other heart failure,85
ICD10CM,I50.9,"Heart failure, unspecified",85
ICD10CM,I51.4,"Myocarditis, unspecified",85
ICD10CM,I51.5,Myocardial degeneration,85
ICD10CM,I21.01,ST elevation (STEMI) myocardial infarction involving left main coronary artery,86
ICD10CM,I21.02,ST elevation (STEMI) myocardial infarction involving left anterior descending coronary artery,86
ICD10CM,I21.09,ST elevation (STEMI) myocardial infarction involving other coronary artery of anterior wall,86
ICD10CM,I21.11,ST elevation (STEMI) myocardial infarction involving right coronary artery,86
ICD10CM,I21.19,ST elevation (STEMI) myocardial infarction involving other coronary artery of inferior wall,86
ICD10CM,I21.21,ST elevation (STEMI) myocardial infarction involving left circumflex coronary artery,86
ICD10CM,I21.29,ST elevation (STEMI) myocardial infarction involving other sites,86
ICD10CM,I21.3,ST elevation (STEMI) myocardial infarction of unspecified site,86
ICD10CM,I21.4,Non-ST elevation (NSTEMI) myocardial infarction,86
ICD10CM,I21.9,"Acute myocardial infarction, unspecified",86
ICD10CM,I21.A1,Myocardial infarction type 2,86
ICD10CM,I21.A9,Other myocardial infarction type,86
ICD10CM,I22.0,Subsequent ST elevation (STEMI) myocardial infarction of anterior wall,86
ICD10CM,I22.1,Subsequent ST elevation (STEMI) myocardial infarction of inferior wall,86
ICD10CM,I22.2,Subsequent non-ST elevation (NSTEMI) myocardial infarction,86
ICD10CM,I22.8,Subsequent ST elevation (STEMI) myocardial infarction of other sites,86
ICD10CM,I22.9,Subsequent ST elevation (STEMI) myocardial infarction of unspecified site,86
ICD10CM,I23.4,Rupture of chordae tendineae as current complication following acute myocardial infarction,86
ICD10CM,I23.5,Rupture of papillary muscle as current complication following acute myocardial infarction,86
ICD10CM,I51.1,"Rupture of chordae tendineae, not elsewhere classified",86
ICD10CM,I51.2,"Rupture of papillary muscle, not elsewhere classified",86
ICD10CM,I20.0,Unstable angina,87
ICD10CM,I23.0,Hemopericardium as current complication following acute myocardial infarction,87
ICD10CM,I23.1,Atrial septal defect as current complication following acute myocardial infarction,87
ICD10CM,I23.2,Ventricular septal defect as current complication following acute myocardial infarction,87
ICD10CM,I23.3,Rupture of cardiac wall without hemopericardium as current complication following acute myocardial infarction,87
ICD10CM,I23.6,"Thrombosis of atrium, auricular appendage, and ventricle as current complications following acute myocardial infarction",87
ICD10CM,I23.7,Postinfarction angina,87
ICD10CM,I23.8,Other current complications following acute myocardial infarction,87
ICD10CM,I24.0,Acute coronary thrombosis not resulting in myocardial infarction,87
ICD10CM,I24.1,Dressler's syndrome,87
ICD10CM,I24.8,Other forms of acute ischemic heart disease,87
ICD10CM,I24.9,"Acute ischemic heart disease, unspecified",87
ICD10CM,I25.110,Atherosclerotic heart disease of native coronary artery with unstable angina pectoris,87
ICD10CM,I25.700,"Atherosclerosis of coronary artery bypass graft(s), unspecified, with unstable angina pectoris",87
ICD10CM,I25.710,Atherosclerosis of autologous vein coronary artery bypass graft(s) with unstable angina pectoris,87
ICD10CM,I25.720,Atherosclerosis of autologous artery coronary artery bypass graft(s) with unstable angina pectoris,87
ICD10CM,I25.730,Atherosclerosis of nonautologous biological coronary artery bypass graft(s) with unstable angina pectoris,87
ICD10CM,I25.750,Atherosclerosis of native coronary artery of transplanted heart with unstable angina,87
ICD10CM,I25.760,Atherosclerosis of bypass graft of coronary artery of transplanted heart with unstable angina,87
ICD10CM,I25.790,Atherosclerosis of other coronary artery bypass graft(s) with unstable angina pectoris,87
ICD10CM,I20.1,Angina pectoris with documented spasm,88
ICD10CM,I20.8,Other forms of angina pectoris,88
ICD10CM,I20.9,"Angina pectoris, unspecified",88
ICD10CM,I25.111,Atherosclerotic heart disease of native coronary artery with angina pectoris with documented spasm,88
ICD10CM,I25.118,Atherosclerotic heart disease of native coronary artery with other forms of angina pectoris,88
ICD10CM,I25.119,Atherosclerotic heart disease of native coronary artery with unspecified angina pectoris,88
ICD10CM,I25.701,"Atherosclerosis of coronary artery bypass graft(s), unspecified, with angina pectoris with documented spasm",88
ICD10CM,I25.708,"Atherosclerosis of coronary artery bypass graft(s), unspecified, with other forms of angina pectoris",88
ICD10CM,I25.709,"Atherosclerosis of coronary artery bypass graft(s), unspecified, with unspecified angina pectoris",88
ICD10CM,I25.711,Atherosclerosis of autologous vein coronary artery bypass graft(s) with angina pectoris with documented spasm,88
ICD10CM,I25.718,Atherosclerosis of autologous vein coronary artery bypass graft(s) with other forms of angina pectoris,88
ICD10CM,I25.719,Atherosclerosis of autologous vein coronary artery bypass graft(s) with unspecified angina pectoris,88
ICD10CM,I25.721,Atherosclerosis of autologous artery coronary artery bypass graft(s) with angina pectoris with documented spasm,88
ICD10CM,I25.728,Atherosclerosis of autologous artery coronary artery bypass graft(s) with other forms of angina pectoris,88
ICD10CM,I25.729,Atherosclerosis of autologous artery coronary artery bypass graft(s) with unspecified angina pectoris,88
ICD10CM,I25.731,Atherosclerosis of nonautologous biological coronary artery bypass graft(s) with angina pectoris with documented spasm,88
